{
  "version": "1.1.0",
  "scene_id": "S01",
  "canvas": "canvas.png",
  "beat_ids": ["S01-B01"],
  "layers": [
    {
      "id": "courier",
      "file": "courier.png",
      "role": "hero",
      "beat_ids": ["S01-B01"],
      "z": 20,
      "anchor": {"x": 0.5, "y": 1},
      "initial": {"x": -200, "y": 600, "scale": 1, "rotation": 0, "opacity": 0},
      "keyframes": [
        {"at": 0.2, "x": -200, "opacity": 0},
        {"at": 2.2, "x": 420, "opacity": 1}
      ]
    }
  ]
}
